,cluster,date,title,first_block,content,company,link,cluster_count
101,100,2024-12-23 16:39:08,"野 향한 반도체 업계의 읍소…""52시간 예외 빼면 반쪽 지원법""","삼성전자 반도체 클린룸 전경. <삼성전자 제공> 우리 반도체 기업들이 줄기차게 요구해 온 반도체 연구개발 인력에 대한 주 52시간 근무 배제 가 요원해질 전망이다. 반도체업계에선 반쪽짜리 지원법 이 될 것이란 우려가 나온다. 23일 업계에 따르면 국회 산업통상자원중소벤처기업위원회는 이번 주 산업통상자원특허소위원회에서 반도체 특별법 심사를 재개할 예정이다. 최근 여야정 협의체 출범에 합의한 국민의힘과 더불어민주당이 정책위원회 차원에서 주요 민생 경제 법안 처리에 대해 의견 일치를 이뤘고, 반도체 특별법도 대상에 포함된 것이다. 앞서 반도체 특별법은 지난달 21일 첫 심사에 돌입했으나, 이후 12 3 비상계엄 사태와 윤석열 대통령 탄핵 정국 여파로 계류돼왔다. 하지만 반도체 기업이 요구해 온 주 52시간 근무 배제는 통과되지 않을 것으로 예상된다. 여야는 반도체 기업에 보조금 등 재정 지원 근거를 담는 데에는 합의했지만, 특별법의 또 다른 축인 주 52시간 근무 배제에 대해선 이견을 좁히지 못했다. 익명을 요청한 한 반도체 업계 관계자는 삼성전자가 주 52시간 예외 규정이 필요성을 담은 자료를 민주당에 제출했으나, 유의미한 결과를 얻지 못한 것 같다 며 업계에선","삼성전자 반도체 클린룸 전경. <삼성전자 제공> 우리 반도체 기업들이 줄기차게 요구해 온 반도체 연구개발(R&D) 인력에 대한 '주 52시간 근무 배제'가 요원해질 전망이다. 반도체업계에선 '반쪽짜리 지원법'이 될 것이란 우려가 나온다. 23일 업계에 따르면 국회 산업통상자원중소벤처기업위원회는 이번 주 산업통상자원특허소위원회에서 반도체 특별법 심사를 재개할 예정이다. 최근 여야정 협의체 출범에 합의한 국민의힘과 더불어민주당이 정책위원회 차원에서 주요 민생·경제 법안 처리에 대해 의견 일치를 이뤘고, 반도체 특별법도 대상에 포함된 것이다. 앞서 반도체 특별법은 지난달 21일 첫 심사에 돌입했으나, 이후 12·3 비상계엄 사태와 윤석열 대통령 탄핵 정국 여파로 계류돼왔다. 하지만 반도체 기업이 요구해 온 주 52시간 근무 배제는 통과되지 않을 것으로 예상된다. 여야는 반도체 기업에 보조금 등 재정 지원 근거를 담는 데에는 합의했지만, 특별법의 또 다른 축인 주 52시간 근무 배제에 대해선 이견을 좁히지 못했다. 익명을 요청한 한 반도체 업계 관계자는 ""삼성전자가 주 52시간 예외 규정이 필요성을 담은 자료를 민주당에 제출했으나, 유의미한 결과를 얻지 못한 것 같다""며 ""업계에선 연구개발 효율성 증대를 위해 52시간 근무 예외가 꼭 필요하다고 보고 있는데, 이 조항이 통과되지 않으면 사실상 반쪽짜리 지원법이 될 것이란 우려가 있다""고 설명했다. 한국반도체산업협회도 아쉽다는 입장이다. 김정회 반도체산업협회 부회장은 지난달 28일 삼성전자 평택캠퍼스서 열린 '반도체산업 초격차 확보를 위한 협회 초청 간담회'에서 김문수 고용노동부 장관에게 R&D 인력에 대한 52시간 근무 예외를 요구한 바 있다. 반도체산업협회 관계자는 ""경쟁국과 메모리 반도체 기술격차가 줄어들고 있는 상황에서 다시 차이를 벌리려면 시간이 필요하다""며 ""R&D 인력에 대한 52시간 근무 배제가 꼭 있어야한다고 보고 있다""고 말했다. 한국팹리스산업협회도 52시간 근무 배제가 꼭 포함돼야 한다는 입장이다. 팹리스 반도체 기업은 반도체를 직접 생산하지 않고 설계와 기술개발만 하는 기업을 말한다. 일의 특성상 인력 대부분이 R&D 인력으로 구성된다. 삼성전자·SK하이닉스에 비해 인력이 적고, 고객사 요구가 있는 시기에 특히 바빠진다는 특성이 있다. 팹리스업계 관계자는 ""업의 특성상 고객사 요구가 있는 시기에는 일이 몰리고, 그렇지 않은 시기에는 일이 아예 없는 경우가 잦다""며 ""주 52시간 근무제를 한 달 208시간으로 변경하는 등의 변화가 허용된다면 연구개발 경쟁력에 큰 도움이 될 것으로 보고 있다""고 전했다. 정부와 국회가 기업의 자율적 판단에만 의존해 업계 내 '꼼수'를 종용한다는 지적도 나왔다. 익명을 요구한 팹리스 기업 한 관계자는 ""주 52시간 근무제가 있어도 팹리스 업계에는 이미 초과 근무로 목표를 달성한 다음에 별도 휴식 시간을 부여받는 문화가 꼼수처럼 자리잡고 있다""며 ""이런 예외 조항을 기업의 자율 판단에만 맡길 게 아니라 정부가 법으로 보장해줄 필요성이 있다""고 밝혔다.",디지털타임스,https://n.news.naver.com/mnews/article/029/0002924845,3
102,101,2024-12-23 10:01:17,'45년 용인 개발 발목' 송탄 상수원보호구역 해제,"환경부 공장설립 제한 승인 지역 변경 고시 예정 시 면적의 11%, 64.43㎢ 족쇄 풀려 이상일 시장 경안천 수변구역 113만평 해제에 이은 겹경사 송탄상수원보호구역 해제 구역도. ⓒ용인시 제공 지난 45년 간 용인 발전의 큰 규제였던 송탄 상수원보호구역 과 그에 따른 공장설립 제한 승인 지역이 완전히 해제됐다. 23일 용인특례시에 따르면 이번에 해제된 규모는 남사 이동읍 64.43㎢, 약 1950만평)으로, 경기도가 송탄 상수원보호구역 변경 을 승인해 공고했다. 환경부는 용인 첨단시스템반도체 국가산업단지가 포함된 공장설립 제한 승인 지역에 대해 20일간의 행정예고를 거쳐 상수원상류 공장설립 제한 승인 지역 변경을 곧 고시하게 된다. 환경부가 지난 10월 수도정비계획 변경 을 승인했고, 한강유역환경청이 11월 평택시에서 제출한 일반수도사업 변경인가 신청을 승인해 고시함에 따라 45년 규제의 해제 절차가 거의 마무리된 상태에서 마지막 남은 절차가 마무리된 것이다. 이에 따라 송탄 상수원보호구역 3.859㎢ 가 전면 해제됐다. 보호구역보다 훨씬 더 큰 땅에 대해 규제를 받았던 용인 평택 안성의 공장설립제한 승인 지역 94.74㎢ 도 규제에서 완전히 풀리게 됐다","환경부 '공장설립 제한·승인 지역' 변경 고시 예정 시 면적의 11%, 64.43㎢(약 1950만평) 족쇄 풀려 이상일 시장 ""경안천 수변구역 113만평 해제에 이은 겹경사"" 송탄상수원보호구역 해제 구역도. ⓒ용인시 제공 [데일리안 = 유진상 기자] 지난 45년 간 용인 발전의 큰 규제였던 '송탄 상수원보호구역'과 그에 따른 공장설립 제한·승인 지역이 완전히 해제됐다. 23일 용인특례시에 따르면 이번에 해제된 규모는 남사·이동읍 64.43㎢, 약 1950만평)으로, 경기도가 '송탄 상수원보호구역 변경(해제)'을 승인해 공고했다. 환경부는 용인 첨단시스템반도체 국가산업단지가 포함된 공장설립 제한·승인 지역에 대해 20일간의 행정예고를 거쳐 '상수원상류 공장설립 제한·승인 지역' 변경을 곧 고시하게 된다. 환경부가 지난 10월 '수도정비계획 변경'을 승인했고, 한강유역환경청이 11월 평택시에서 제출한 '일반수도사업 변경인가' 신청을 승인해 고시함에 따라 45년 규제의 해제 절차가 거의 마무리된 상태에서 마지막 남은 절차가 마무리된 것이다. 이에 따라 송탄 상수원보호구역 3.859㎢(용인 1.572㎢, 평택 2.287㎢)가 전면 해제됐다. 보호구역보다 훨씬 더 큰 땅에 대해 규제를 받았던 용인·평택·안성의 공장설립제한·승인 지역 94.74㎢(용인 62.86㎢, 평택 13.09㎢, 안성 18.79㎢)도 규제에서 완전히 풀리게 됐다. '송탄 상수원보호구역'은 평택에 하루 1만 5000톤의 생활용수 공급을 위해 지난 1979년 지정돼 용인 지역 발전에 제약을 가했으며, 용인 시민의 재산권 행사도 크게 제한해 용인과 평택의 갈등 요인으로 작용했다. 이에 따라 용인에선 송탄 상수원보호구역을 해제해야 한다는 목소리가 오래 전부터 분출했고, 2015년에는 용인시민들이 평택시청 앞에서 상수원보호구역과 공장설립 제한 및 승인지역 해제를 요구하는 시위를 벌이기도 했다. '송탄 상수원보호구역' 해제의 실마리가 풀린 것은 민선 8기 들어 반도체 산업 육성 정책을 강조해 온 이상일 시장이 지난해 3월 15일 처인구 이동·남사읍 일대 728만㎡(약 220만평)에 삼성전자가 360조원을 투자하는 첨단 시스템반도체 국가산업단지를 유치하면서다. 이상일 시장은 ""올해가 가기 전에 용인 남사·이동읍의 방대한 땅이 45년 규제의 족쇄에서 풀려나게 됐고, 평택시와의 갈등 요인도 뿌리뽑게 됐다는 역사에 남을만한 기쁜 소식을 시민들께 전해드릴 수 있어서 감개무량하다""며 ""지난달 용인 포곡·모현읍과 유방동의 수변구역 112.8만평(3.728㎢)이 25년 간의 규제에서 풀려난 데 이은 겹경사를 시민들과 함께 환영한다""고 말했다. 이어 ""역사적인 규제 해제가 이뤄지는 과정에서 많은 도움을 주신 평택시, 경기도, 환경부, 국토교통부 등 관련 기관 관계자들과 인내와 지혜로 규제 해제를 이끌어 낸 시의 공직자들에게 감사의 뜻을 전한다""고 말했다.",데일리안,https://n.news.naver.com/mnews/article/119/0002906895,18
103,102,2024-12-23 03:08:10,"美 퀄컴, 英 ARM과 ‘칩 지식재산권 소송’서 승소","“누비아 인수후 계약 위반 안해” 퀄컴 AP 사용 업계 불확실성 해소 미국 반도체사 퀄컴과 영국의 반도체사 ARM 간 칩 설계 라이선스 를 두고 벌어진 소송에서 퀄컴에 유리한 첫 판결이 나왔다. 20일 블룸버그통신 등에 따르면 미 델라웨어 연방법원 배심원단은 이날 퀄컴과 ARM 간 칩 지식재산권 침해 소송에서 퀄컴의 손을 들어줬다. 배심원단은 “퀄컴이 반도체 설계사 누비아를 인수하면서 획득한 ARM 관련 계약 조건을 위반하지 않았다”고 결론 내렸다. 이번 소송은 퀄컴이 2021년 ARM 라이선스를 보유한 칩 설계회사 누비아를 인수하면서 불거졌다. ARM은 퀄컴이 누비아를 인수했어도 자신들의 승인 없이는 누비아 라이선스를 사용할 수 없다고 주장하며 2022년 8월 소송을 제기했고, 퀄컴도 맞소송에 나섰다. 퀄컴이 누비아 기술을 기반으로 만드는 애플리케이션 프로세서 ‘스냅드래건’은 삼성전자, 샤오미, 아너 등의 스마트폰에도 탑재된다. 이번 판결로 ARM은 재심 청구 의향을 밝혔지만 관련 업계는 불확실성을 일부 해소할 수 있게 됐다.","“누비아 인수후 계약 위반 안해” 퀄컴 AP 사용 업계 불확실성 해소 미국 반도체사 퀄컴과 영국의 반도체사 ARM 간 칩 설계 라이선스(사용권)를 두고 벌어진 소송에서 퀄컴에 유리한 첫 판결이 나왔다. 20일(현지 시간) 블룸버그통신 등에 따르면 미 델라웨어 연방법원 배심원단은 이날 퀄컴과 ARM 간 칩 지식재산권 침해 소송에서 퀄컴의 손을 들어줬다. 배심원단은 “퀄컴이 반도체 설계사 누비아를 인수하면서 획득한 ARM 관련 계약 조건을 위반하지 않았다”고 결론 내렸다. 이번 소송은 퀄컴이 2021년 ARM 라이선스를 보유한 칩 설계회사 누비아를 인수하면서 불거졌다. ARM은 퀄컴이 누비아를 인수했어도 자신들의 승인 없이는 누비아 라이선스를 사용할 수 없다고 주장하며 2022년 8월 소송을 제기했고, 퀄컴도 맞소송에 나섰다. 퀄컴이 누비아 기술을 기반으로 만드는 애플리케이션 프로세서(AP) ‘스냅드래건’은 삼성전자, 샤오미, 아너 등의 스마트폰에도 탑재된다. 이번 판결로 ARM은 재심 청구 의향을 밝혔지만 관련 업계는 불확실성을 일부 해소할 수 있게 됐다.",동아일보,https://n.news.naver.com/mnews/article/020/0003605733,4
104,103,2024-12-23 16:03:53,"코스피, 사흘만에 반등 2,440대 회복…외국인·기관 '동반 매수'(종합)","美 보조금 불확실성 해소에 반도체주 상승 조선주 연일 강세 외국인 기관 양시장서 순매수 코스닥 1.6% 올라 680대 목전 증시 상황은? = 23일 오전 서울 중구 하나은행 본점 딜링룸 현황판에 코스피, 원/달러 환율이 표시돼 있다. 2024.12.23 = 코스피와 코스닥이 23일 외국인과 기관의 저가 매수로 사흘 만에 반등에 성공했다. 코스피는 1.5% 넘게 올라 2,440대를 회복했고, 코스닥은 1.6% 상승해 680대에 바짝 다가섰다. 이날 코스피 지수는 전장 대비 37.90포인트 오른 2,442.01로 거래를 마쳤다. 지수는 전장 대비 19.21포인트 상승한 2,423.36으로 강세 출발해 장중 상승 폭을 키워 2,440대로 올라섰다. 유가증권시장에서 외국인이 1천454억원, 기관이 4천337억원 동반 매수에 나서며 지수 상승을 견인했다. 반면 개인은 6천775억원 매도 우위를 보였다. 코스피200선물 시장에서 외국인은 2천386억원 순매수했다. 이날 오후 3시 30분 기준 미국 달러 대비 원화 환율은 전 거래일보다 0.6원 오른 1,452.0원이다. 원/달러 환율은 주간 거래 기준 3거래일째 1,450원을 웃돌고 있다. 다만 지난주 말 발표된 미국의","美 보조금 불확실성 해소에 반도체주 상승…조선주 연일 강세 외국인·기관 양시장서 순매수…코스닥 1.6% 올라 680대 목전 '증시 상황은?' (서울=연합뉴스) 김성민 기자 = 23일 오전 서울 중구 하나은행 본점 딜링룸 현황판에 코스피, 원/달러 환율이 표시돼 있다. 2024.12.23 ksm7976@yna.co.kr (서울=연합뉴스) 곽윤아 기자 = 코스피와 코스닥이 23일 외국인과 기관의 저가 매수로 사흘 만에 반등에 성공했다. 코스피는 1.5% 넘게 올라 2,440대를 회복했고, 코스닥은 1.6% 상승해 680대에 바짝 다가섰다. 이날 코스피 지수는 전장(20일) 대비 37.90포인트(1.57%) 오른 2,442.01로 거래를 마쳤다. 지수는 전장 대비 19.21포인트(0.8%) 상승한 2,423.36으로 강세 출발해 장중 상승 폭을 키워 2,440대로 올라섰다. 유가증권시장에서 외국인이 1천454억원, 기관이 4천337억원 동반 매수에 나서며 지수 상승을 견인했다. 반면 개인은 6천775억원 매도 우위를 보였다. 코스피200선물 시장에서 외국인은 2천386억원 순매수했다. 이날 오후 3시 30분 기준 미국 달러 대비 원화 환율은 전 거래일보다 0.6원 오른 1,452.0원이다. 원/달러 환율은 주간 거래 기준 3거래일째 1,450원을 웃돌고 있다. 다만 지난주 말 발표된 미국의 11월 개인소비지출(PCE) 가격지수가 시장 예상치를 밑돌며 투자 심리가 개선된 가운데 외국인과 기관의 저가 매수세가 유입되자 지수가 큰 폭으로 오른 모습이다. 이경민 대신증권 연구원은 ""코스피는 최근 2,380~2,400구간에서 하단이 견고하게 형성된 가운데 저가 매수세가 유입되며 지난 20일의 낙폭을 만회했다""고 말했다. 삼성전자(0.94%), SK하이닉스(0.65%), 한미반도체(8.65%) 등 코스피 대장주인 반도체 종목이 일제히 강세를 보였다. 삼성전자와 SK하이닉스가 미국 정부로부터 받는 투자 보조금이 최종 확정되며 트럼프 당선 이후 시장에 퍼졌던 반도체 업계의 불확실성이 해소된 영향이다. 또한 브로드컴이 두 회사에 차세대 고대역폭메모리(HBM) 제품인 HBM4 공급을 요청했다는 소식이 전해진 영향도 있는 것으로 보인다. 미국의 조선업 역량 강화 기조에 따른 수혜가 기대되는 HJ중공업(13.85%), 한화오션(7.04%), HD한국조선해양(8.24%) 등 조선주도 동반 상승했다. LG에너지솔루션은 장중 방향을 바꿔 0.42% 올랐고, 최근 상승세가 두드러졌던 NAVER(-4.29%), 카카오(-2.70%)는 차익 실현 거래가 이뤄지며 약세를 보였다. 업종별로 보면 정보기술(IT)서비스(-1.90%), 운송/창고(-0.12%)를 제외한 대다수 업종이 올랐다. 특히 금속(4.69%), 기계/장비(3.25%), 보험(3.50%) 등의 상승세가 눈에 띄었다. 코스닥 지수도 전장보다 10.93포인트(1.64%) 오른 679.24로 장을 마쳐 3거래일 만에 반등했다. 지수는 전장 대비 5.95포인트(0.89%) 오른 674.26으로 출발한 뒤 상승 폭을 키웠고, 장중 2.22% 오른 683.16까지 오르기도 했다. 코스닥 시장에서 외국인과 기관이 각각 1천311억원, 1천91억원 순매수했고 개인은 2천336억원 매도 우위를 보였다. 에코프로비엠(0.61%), 리가켐바이오(4.06%) 등 시총 상위 다수 종목이 올랐고, HLB(-2.87%), 에코프로(-0.94%) 등은 내렸다. 알테오젠은 보합을 나타냈다. 이날 하루 유가증권시장과 코스닥시장의 거래대금은 각각 7조1천826억원과 5조2천545억원이다. ori@yna.co.kr",연합뉴스,https://n.news.naver.com/mnews/article/001/0015122081,2
105,104,2024-12-23 09:22:18,돌아온 외국인에 코스피 '화색'…2420선 회복[개장시황],"코스피 상승 = 지난주 미국 통화정책 불확실성에 급락했던 코스피가 23일 반등했다. 이탈했던 외국인 투자자들도 순매수로 전환했다. 이날 오전 9시 12분 기준 코스피는 전날 대비 19.36p 상승한 2423.51을 가리키고 있다. 외국인은 212억 원, 기관은 303억 원 각각 순매수 중이다. 개인은 552억 원 순매도하고 있다. 코스피는 지난 20일 2404.15로 거래를 마쳤다. 장중 2389.86까지 밀리면서 지난 10일 이후 처음으로 2400선 밑으로 내려가기도 했다. 외국인은 하루 동안 8170억 원을 순매도하며 지난 10월 31일 이후 가장 큰 매도세를 기록했다. 하지만 미국 증시 반등으로 국내 증시에 안도감이 퍼지며 투심이 회복된 것으로 해석된다. 지난 20일 미국 뉴욕증시는 큰 폭으로 상승 마감했다. 다우존스산업평균지수는 1.18%, 스탠더드앤푸어스 500 지수는 1.09% 상승했다. 기술주 중심의 나스닥 종합지수는 1.03%, 중소형주 중심의 러셀2000 지수도 0.82% 올랐다. 김석환 미래에셋증권 연구원은 미 연방준비제도 가 선호하는 인플레이션 지표인 개인소비지출 가격지수가 예상을 하회해 인플레이션 압박이 비교적 완화될 수 있다는 시장의 ","코스피 상승 (서울=뉴스1) 박승희 기자 = 지난주 미국 통화정책 불확실성에 급락했던 코스피가 23일 반등했다. 이탈했던 외국인 투자자들도 순매수로 전환했다. 이날 오전 9시 12분 기준 코스피는 전날 대비 19.36p(0.81%) 상승한 2423.51을 가리키고 있다. 외국인은 212억 원, 기관은 303억 원 각각 순매수 중이다. 개인은 552억 원 순매도하고 있다. 코스피는 지난 20일 2404.15로 거래를 마쳤다. 장중 2389.86까지 밀리면서 지난 10일 이후 처음으로 2400선 밑으로 내려가기도 했다. 외국인은 하루 동안 8170억 원을 순매도하며 지난 10월 31일(8583억 원 순매도) 이후 가장 큰 매도세를 기록했다. 하지만 미국 증시 반등으로 국내 증시에 안도감이 퍼지며 투심이 회복된 것으로 해석된다. 지난 20일(현지시간) 미국 뉴욕증시는 큰 폭으로 상승 마감했다. 다우존스산업평균지수는 1.18%, 스탠더드앤푸어스(S&P)500 지수는 1.09% 상승했다. 기술주 중심의 나스닥 종합지수는 1.03%, 중소형주 중심의 러셀2000 지수도 0.82% 올랐다. 김석환 미래에셋증권 연구원은 ""미 연방준비제도(Fed)가 선호하는 인플레이션 지표인 개인소비지출(PCE) 가격지수가 예상을 하회해 인플레이션 압박이 비교적 완화될 수 있다는 시장의 기대감으로 시장이 상승했다""고 설명했다. 11월 PCE 가격지수는 전년 동월 대비 2.4% 상승, 둔화세를 멈추고 정체된 모습을 보였다. 이어 ""연방정부의 잠재적 셧다운 위기에도 불구하고 시장은 오히려 상승세를 보였는데, 이는 당분간 시장 변동성을 다소 진정시킬 수 있는 요인으로 작용할 가능성이 있다""고 부연했다. 코스피 시가총액 상위 10개 종목 중 현대차(005380) 2.61%, KB금융(05560) 1.4%, 삼성전자우(005935) 1.39%, SK하이닉스(000660) 1.13%, 삼성전자(005930) 0.94%, 기아(000270) 0.59%, 삼성바이오로직스(207940) 0.43%, 셀트리온(068270) 0.36% 등은 상승했다. NAVER(035420) -1.43%, LG에너지솔루션(373220) -1.4% 등은 하락했다. 증권가에선 국내 증시 반등에 무게를 싣고 있다. 이번 주 국내 증시는 크리스마스 휴장과 배당락 이벤트 등을 치러야 하지만, 저가 매수 유인 지속, 달러·원 환율 급등세 진정 등으로 저점을 높여가는 흐름을 보일 것이라는 전망이다. 한지영 키움증권 연구원은 ""연말 거래 부진 및 배당락 이벤트는 단기 영향력만 행사하는 재료가 될 뿐, 현시점에서는 매크로 및 밸류에이션에 주안점을 두는 것이 타당하다""며 ""12월 FOMC 여진은 잔재해 있겠지만 주가가 상당 부분 그 충격을 소화하며 내성이 생기고 있다는 점에 주목할 필요가 있어 변동성에도 저점을 높이는 흐름을 보일 것""이라고 예상했다. 코스닥은 전일 대비 6.09p(0.91%) 상승한 674.40을 가리키고 있다. 코스닥도 지난 20일 2.35% 하락한 668.31로 거래를 마친 바 있다. 이날 기관은 11억 원, 외국인은 112억 원 각각 순매수하고 있다. 개인은 112억 원 순매도했다. 코스닥 시가총액 상위 10개 종목 중 삼천당제약(000250) 25.66%, 알테오젠(96170) 1.81%, HLB(028300) 1.72%, 클래시스(214150) 1.23%, 리가켐바이오(41080) 0.96%, 신성델타테크(065350) 0.96% 등은 상승했다. 에코프로(086520) -1.57%, 에코프로비엠(247540) -1.23%, 휴젤(45020) -0.53%, 리노공업(058470) -0.16% 등은 하락했다.",뉴스1,https://n.news.naver.com/mnews/article/421/0007981926,2
