,cluster,date,title,first_block,content,company,link,cluster_count
184,183,2024-06-23 13:52:12,"이재용‧구광모‧최태원, 연이어 미국행…AI‧반도체‧배터리 전략 점검","이재용, 2주간 저커버그 등 빅테크 수장 만나며 강행군 구광모, 현지 LG 계열사 사업장 점검 미래준비 현황도 살펴 최태원, AI 반도체 사업점검 및 파트너사 만남 위해 미국행 구광모 LG 회장 이 미국 실리콘밸리에서 AI 반도체 설계 업체 텐스토렌트 의 CEO 짐 켈러 와 기념촬영하고 있다. ⓒLG 주요 대기업 총수들이 잇달아 미국 출장길에 올라 반도체‧배터리 등 현지 사업을 점검하고 인공지능 을 비롯한 미래 전략사업 육성을 위한 동맹 모색에 나섰다. 23일 LG그룹에 따르면 구광모 LG 회장은 지난 17일 부터 나흘간 미국 테네시와 실리콘밸리를 방문해 북미 현지 사업 전략을 점검하고, 미래준비 현황을 살폈다. 구 회장은 테네시에서 LG전자 생산법인, LG에너지솔루션 GM 합작법인 얼티엄셀즈 등을 방문하고, 실리콘밸리에서는 LG의 미래준비를 위한 스타트업 투자 허브 LG테크놀로지벤처스 와 LG전자 북미이노베이션센터 를 찾아 AI 분야 등 미래준비를 위한 스타트업 투자‧육성 전략을 논의했다. 구 회장은 주요 계열사의 북미 전진기지로 자리매김한 테네시에서 시장‧고객 트렌드, 통상정책 등 급변하는 사업 환경에 적극 대응하기 위해 사업 전략을 점검하고, 장기적 관","이재용, 2주간 저커버그 등 빅테크 수장 만나며 '강행군' 구광모, 현지 LG 계열사 사업장 점검…미래준비 현황도 살펴 최태원, AI·반도체 사업점검 및 파트너사 만남 위해 미국행 구광모 LG 회장(오른쪽)이 미국 실리콘밸리에서 AI 반도체 설계 업체 '텐스토렌트'의 CEO '짐 켈러'와 기념촬영하고 있다. ⓒLG [데일리안 = 박영국 기자] 주요 대기업 총수들이 잇달아 미국 출장길에 올라 반도체‧배터리 등 현지 사업을 점검하고 인공지능(AI)을 비롯한 미래 전략사업 육성을 위한 동맹 모색에 나섰다. 23일 LG그룹에 따르면 구광모 LG 회장은 지난 17일(현지시간)부터 나흘간 미국 테네시와 실리콘밸리를 방문해 북미 현지 사업 전략을 점검하고, 미래준비 현황을 살폈다. 구 회장은 테네시에서 LG전자 생산법인, LG에너지솔루션·GM 합작법인 얼티엄셀즈(Ultium Cells) 등을 방문하고, 실리콘밸리에서는 LG의 미래준비를 위한 스타트업 투자 허브 LG테크놀로지벤처스(LG Technology Ventures)와 LG전자 북미이노베이션센터(LG NOVA)를 찾아 AI 분야 등 미래준비를 위한 스타트업 투자‧육성 전략을 논의했다. 구 회장은 주요 계열사의 북미 전진기지로 자리매김한 테네시에서 시장‧고객 트렌드, 통상정책 등 급변하는 사업 환경에 적극 대응하기 위해 사업 전략을 점검하고, 장기적 관점의 미래준비 현장인 실리콘밸리에서는 10년, 20년 후의 미래를 위한 도전을 강조했다. 구 회장은 이번 북미 현장 방문 중 직원들을 만나는 총 6번의 자리에서 가장 먼저 “여러분의 노력과 헌신에 감사드린다”고 격려하며 “자신감과 자부심을 가져 달라”고 당부했다. 또 “지속성장의 긴 레이스에서 이기기 위해 도전과 도약의 빅스텝을 만들어 나가자”고 말했다. LG전자 테네시 공장을 찾은 구 회장은 H&A사업본부장 류재철 사장, 북미지역회장 정규황 부사장 등과 함께 전자 북미 사업 현황을 직접 점검하고, 미국 시장의 고객‧경쟁‧유통 변화, 통상정책 등 사업환경 변화에 따른 대응 시나리오 등을 논의했다. 로봇 자동화, 무인 물류 등 스마트팩토리 기술이 적용된 세탁기, 건조기 생산라인도 살펴봤다. 구 회장은 LG에너지솔루션과 GM의 합작법인 얼티엄셀즈 제2공장을 찾아 북미 전기차 시장 전망과 주요 고객사 동향에 관한 설명을 듣고, 배터리, 양극재 등 전장 부품 사업 포트폴리오 운영 계획 및 투자 전략을 점검했다. 구 회장은 “시장‧고객 트렌드, 경쟁 구도, 통상 정책‧물류 등 사업 환경의 변동성은 모두가 동일하게 마주한 상황”이라며 “이를 잘 극복하기 위해 차별적 고객가치 제공을 위한 제품 포트폴리오 강화, 공급망 구축, 공정 혁신, 현지화 역량 등 근본 경쟁력을 강화해 다시 한 번 도약할 수 있는 기회를 만들어 나가자”고 당부했다. 구 회장은 실리콘밸리에서는 미래사업 분야를 살폈다. 미국 실리콘밸리는 글로벌 빅테크들의 격전지이자 스타트업의 메카로 전 세계에서 AI, 자율주행 등 첨단 기술이 가장 치열하게 논의되는 지역이다. LG는 2018년 실리콘밸리에 기업형 벤처캐피탈(CVC)인 LG테크놀로지벤처스, 2020년에는 LG전자 북미이노베이션센터(LG NOVA)를 설립하고, 글로벌 스타트업 등과 협업을 강화하며 미래성장 동력 발굴에 힘써왔다. LG테크놀로지벤처스를 찾은 구 회장은 김동수 CEO(부사장)를 비롯한 경영진과 만나 지금까지의 투자 및 사업개발 현황을 보고받고, 구성원들을 격려했다. 또한 AI 등 LG의 미래사업 경쟁력을 강화하기 위한 스타트업 투자 포트폴리오 전략에 대해 의견을 나눴다. 구 회장은 실리콘밸리에서 LG전자 북미이노베이션센터(LG NOVA)도 방문했다. LG전자 북미이노베이션센터는 새로운 사업모델을 발굴하고, 스타트업과의 협력을 목적으로 2020년 설립됐다. 구 회장은 이석우 LG전자 북미이노베이션센터장(부사장)을 비롯한 구성원들과 만나 아웃사이드-인 방식으로 새로운 변화를 만드는 시도들을 격려하며, 신사업 개발 추진 현황 등을 경청하고 헬스케어, 클린테크 분야의 사업화 추진 사례를 살폈다. 구광모 회장은 실리콘밸리에서 LG 사업장 외에도 세계 최고 수준의 기술력을 가진 AI 스타트업을 찾아 LG의 AI 경쟁력을 한 단계 높일 수 있는 AI 분야 최신 기술 동향을 살폈다. AI 반도체 설계업체 ‘텐스토렌트(Tenstorrent)’와 AI 휴머노이드 로봇 스타트업 ‘피규어 AI(Figure AI)’를 방문해 반도체 설계부터 로봇 등 다른 분야에 이르기까지 AI 밸류체인(Value Chain) 전반을 세심하게 살폈다. 텐스토렌트를 방문한 구 회장은 짐 켈러(Jim Keller) CEO와 만나 AI 반도체의 트렌드와 텐스토렌트의 기술에 대한 설명을 듣고, AI 확산에 따른 반도체 산업 영향에 대한 의견을 나눴다. 또, 피규어 AI 창업자이자 CEO인 브렛 애드콕(Brett Adcock)을 만나 휴머노이드 로봇 시장 현황과 기술 트렌드에 대한 설명을 듣고, 피규어 AI의 휴머노이드 로봇인 ‘피규어 원(Figure 01)’이 구동하는 모습을 살펴봤다. 이재용 삼성전자 회장이 11일(현지시간) 미국 서부 팔로 알토에 위치한 마크 저커버그 메타 CEO 자택을 방문해 저커버그 CEO와 함께 기념촬영을 하고 있다. ⓒ삼성전자 앞서 이재용 삼성전자 회장은 지난달 31일부터 이달 13일까지 2주간 미국 장기출장을 다녀왔다. 미국 동부에서 버라이즌 CEO와의 회동 등 일정을 소화한 뒤 서부로 날아가 글로벌 IT 산업을 주도하는 메타, 아마존, 퀄컴 등 IT‧AI‧반도체 분야의 빅테크 기업 CEO들과 잇따라 만나는 강행군을 펼쳤다. 이 회장은 이번 출장을 통해 새로운 기술과 서비스의 등장으로 해마다 글로벌 시가총액 1위 기업이 바뀔 정도로 격화하고 있는 ‘기술 초경쟁’ 시대 속에서의 삼성의 글로벌 위상과 미래 기술 경쟁력을 점검했다. 또, 삼성의 스마트폰, TV, 가전, 네트워크, 메모리, 파운드리 부문의 기존 고객사와 협력을 확대하면서, AI 등 첨단 분야에서 삼성과 고객사의 기술 경쟁력을 결합해 상호 윈윈하며 미래 경쟁력을 확보할 수 있는 새로운 협력 모델 구축에도 힘을 쏟았다. 이 회장은 미국 출장 10일 미국 새너제이에 위치한 삼성전자 DSA에서 크리스티아노 아몬(Cristiano Amon) 퀄컴 사장 겸 CEO를 만나 ▲AI 반도체 ▲차세대 통신칩 등 새롭게 열리는 미래 반도체 시장에서의 협력 확대 방안을 논의했다. 삼성전자와 퀄컴은 오랜 협력관계를 맺고 있다. 퀄컴은 삼성 모바일 제품에 최첨단 스냅드래곤 플랫폼을 탑재 했으며, 최근에는 AI PC 및 모바일 플랫폼으로 협력을 확대하고 있다. 11일에는 미국 서부 팔로 알토에 위치한 마크 저커버그 메타 CEO의 자택으로 초청받아 단독 미팅을 갖고 AI‧가상현실‧증강현실 등 미래 ICT 산업 및 S/W 분야에서의 협력 방안을 논의했다. 이 회장은 2011년 저커버그 CEO 자택에서 처음 만난 이후로 현재까지 8번의 미팅을 가질 정도로 각별한 우정을 쌓아오고 있다. 삼성전자와 메타는 이번 두 수장들의 만남을 계기로 AI 분야로 협력을 더욱 확대해 나갈 것으로 보인다. 12일에는 시애틀 아마존 본사를 찾아 앤디 재시(Andy Jassy) 아마존 CEO를 만났다. 아마존은 세계 1위 클라우드 서비스 업체로, 차세대 메모리를 비롯한 반도체 사업의 핵심 비즈니스 파트너 중 하나다. 이 회장과 재시 CEO는 생성형AI와 클라우드 컴퓨팅 등 현재 주력 사업에 대한 시장 전망을 공유하며 추가 협력에 대한 의견을 나눴다. 재시 CEO는 작년 4월 생성형AI에 본격적으로 참여할 계획을 밝히고 클라우드 기반 AI 서비스 혁신에 공을 들이고 있다. 삼성전자와 아마존은 반도체 이외에도 TV‧모바일‧콘텐츠 등 다양한 분야에서 협력하고 있으며, 이번 이 회장과 재시 CEO의 만남을 통해 삼성과 아마존의 협력 관계가 한층 더 깊어질 것으로 기대된다. 이 회장은 이번 미국 출장기간 중에 퀄컴 뿐 아니라 글로벌 팹리스(설계전문) 시스템반도체 기업들과도 연이어 만나 파운드리(위탁생산) 사업 협력 확대 및 미래 반도체 개발을 위한 제조기술 혁신 등에 대해 의견을 나눴다. 최태원 SK그룹 회장이 2023년 6월 15일 서울 광진구 그랜드 워커힐 서울에서 열린 ‘2023 확대경영회의’에서 기조 연설을 하고 있다. ⓒSK 최태원 SK그룹 회장은 지난 22일 오후 미국 출장길에 올랐다. 미국에서 10여일 간의 일정을 소화하며 SK그룹의 ‘AI 생태계’를 바탕으로 한 글로벌 기업과의 협업을 모색할 것으로 보인다. 방문하는 지역 또한 빅 테크들이 모여 있는 새너제이 ‘실리콘밸리’에 국한하지 않고, 현지 파트너사들이 있는 미국 여러 곳이 될 것으로 알려졌다. SK그룹은 ‘반도체부터 서비스까지’ AI에 필요한 모든 생태계를 육성하고 있다. SK하이닉스는 AI 시스템 구현에 필수적인 초고성능 AI용 메모리 제품 ‘고대역폭메모리(HBM)’와 AI 서버 구축에 최적화된 ‘고용량 DDR5 모듈’, ‘엔터프라이즈 SSD(eSSD)’ 등 경쟁력 있는 제품들을 앞세워 글로벌 AI용 메모리 시장을 선도하고 있다. 서비스 분야에서는 SK텔레콤의 생성형 AI 서비스 ‘에이닷’이 차별화된 개인비서 기능으로 400만명에 육박하는 가입자를 끌어 모았으며, SK그룹의 에너지·자원 사업역량을 한데 모은 ‘클린에너지솔루션’은 데이터센터에 필요한 청정 에너지 확보와 전력 사용 절감 대안으로 주목 받고 있다. 최 회장은 이달 6일 대만에서 웨이저자 TSMC 신임 회장과 만나 “인류에 도움되는 AI 초석을 함께 만들자”며 SK의 AI 방향이 ‘사람’에 있음을 강조했다. 미국 AI·반도체 빅 테크 경영진들도 최근 인류의 미래에 공헌하는 AI를 강조하고 있어, 최 회장과 이와 관련한 여러 의견을 나눌 것으로 전망된다. 주요 기업 총수들의 잇단 미국행은 산업 패러다임의 급격한 변화와 경영 불확실성 증대 상황에서 글로벌 산업 트렌드를 선도하는 미국에서 업계 동향을 살피고 자사의 미국 내 사업 전략을 재점검하기 위한 것으로 풀이된다. 현지 빅테크 및 선도적 기술력을 가진 스타트업 CEO들과 네트워크를 다지고 ‘우군’을 확보하려는 의지도 읽힌다. 재계 한 관계자는 “대외 환경이 빠르게 변할수록 변화를 이끌고 대응하는 선두그룹의 움직임을 가까이서 캐치할 필요가 있다”면서 “총수들 개개인의 글로벌 네트워크를 강화해 기업 경쟁력을 제고하는 것도 중요한 일”이라고 말했다.",데일리안,https://n.news.naver.com/mnews/article/119/0002842682,2
185,184,2024-06-23 13:07:59,"AIoT 기반 재해예방기술 출원 한국이 48.5% 세계 1위…미국, 일본 순","미국 일본 중국 순 특허청 한국, 2위 미국보다 2.7배 출원 많아 /뉴스1 = 특허청이 주요국 특허청 에 출원된 전 세계 AIoT 기반의 재해예방 특허를 분석한 결과, 사물인터넷 과 인공지능 기술이 결합된 지능형 사물인터넷 을 활용해 홍수 등 재해를 예방하는 기술 출원이 최근 10년 사이 연평균 19.5% 증가한 것으로 나타났다. AIoT 기반 자연재해 예방 기술은 위성 데이터, 기상 데이터, IoT 센서 데이터 등의 빅데이터를 수집하고, AI학습을 통해 피해 상황을 예측하여, 위치정보기반 대피 경로를 제공하는 기술이다. 전체 1598건 중 한국 국적의 출원이 48.5% 로 1위를 차지했으며, 미국 , 일본 , 중국 이 뒤를 이었다. 특히, 한국은 출원량 2위를 차지한 미국보다 2.7배 많은 출원을 한 것으로 나타나, 당분간 AIoT 기반의 재해 예방 기술 분야에서 한국의 우위가 지속될 것으로 전망된다. 재해 유형별로 살펴보면, 지질재해 분야 출원량이 51.4%로 가장 많았으며, 풍수해 분야 , 기상재해 분야 , 해양재해 분야 순으로 나타났다. 출원 증가율은 풍수해 분야가 가장 높은 것 으로 나타났는데, 이는 최근 전 세계적으로 홍수 등의 풍수해가 급증하고","미국 일본 중국 순 특허청 ""한국, 2위 미국보다 2.7배 출원 많아"" /뉴스1 (대전ㆍ충남=뉴스1) 박찬수 기자 = 특허청이 주요국 특허청(IP5: 한국, 미국, 중국, EU, 일본)에 출원된 전 세계 AIoT 기반의 재해예방 특허를 분석한 결과, 사물인터넷(IoT)과 인공지능(AI) 기술이 결합된 지능형 사물인터넷(AIoT)을 활용해 홍수 등 재해를 예방하는 기술 출원이 최근 10년(2012년~2021년) 사이 연평균 19.5% 증가한 것으로 나타났다. AIoT 기반 자연재해 예방 기술은 위성 데이터, 기상 데이터, IoT 센서 데이터 등의 빅데이터를 수집하고, AI학습을 통해 피해 상황을 예측하여, 위치정보기반 대피 경로를 제공하는 기술이다. 전체 1598건 중 한국 국적의 출원이 48.5%(775건)로 1위를 차지했으며, 미국(18.1%, 290건), 일본(14.4%, 230건), 중국(10.3%, 164건)이 뒤를 이었다. 특히, 한국은 출원량 2위를 차지한 미국보다 2.7배 많은 출원을 한 것으로 나타나, 당분간 AIoT 기반의 재해 예방 기술 분야에서 한국의 우위가 지속될 것으로 전망된다. 재해 유형별로 살펴보면, 지질재해 분야 출원량이 51.4%로 가장 많았으며, 풍수해 분야(23.9%), 기상재해 분야(17.0%), 해양재해 분야(7.7%) 순으로 나타났다. 출원 증가율은 풍수해 분야가 가장 높은 것(연평균 28.9%)으로 나타났는데, 이는 최근 전 세계적으로 홍수 등의 풍수해가 급증하고 있어 관련 예방 기술에 대한 요구가 증가한 것으로 보인다. 다출원을 살펴보면 삼성전자(36건), LG전자(35건)가 나란히 1위와 2위를 기록했으며, 3위스카이 모션(32건), 4위 퀄컴(29건), 5위 인터디지탈(26건)이 뒤를 이었다. 한국이 세계 최초로 이동통신망을 통해 재난 문자서비스를 제공한 이후 각국의 통신 관련 회사들도 재난경보 기술을 활발히 출원하고 있는 것으로 분석된다. 황윤구 특허청 사물인터넷심사과장은 “이상기후로 인한 자연재해가 늘어나고 있으나, AIoT 기반 자연재해 예방 기술의 발전은 자연재해로 인한 피해 감소에 기여할 것으로 예상된다”면서 “국민 생명과 재산을 지키는 기술의 가치를 높이고 널리 활용될 수 있도록, 고품질의 심사뿐만 아니라 통계 자료 등을 적시에 제공하겠다”고 말했다.",뉴스1,https://n.news.naver.com/mnews/article/421/0007618051,3
186,185,2024-06-23 10:01:12,"삼성전자, 프랑스 파리서 'Open always wins' 올림픽 옥외 광고 진행","삼성전자가 프랑스 파리에서 올림픽 메시지 Open always wins 를 담은 옥외 광고를 진행하고 있다.. 삼성전자 제공 삼성전자가 프랑스 파리에서 올림픽 옥외광고를 선보이며 2024 파리 올림픽 분위기를 고조시키고 있다고 23일 밝혔다. 삼성전자의 올림픽 옥외광고는 프랑스 파리 주요 명소인 오페라 가르니에 , 라 데팡스 등에서 진행 중이며 패럴림픽이 종료되는 9월 말까지 운영된다. 옥외광고는 삼성전자의 올림픽 메시지 Open always wins 를 담고 있으며, 갤럭시 Z 플립5와 함께 파리 올림픽 신규 종목 브레이킹 을 표현해 전세계 올림픽 선수들과 팬들의 새로운 가능성을 응원한다. 삼성전자는 개방성 과 포용성 을 중시하는 브랜드 가치를 반영해 열린 마음으로 모두가 협력해 도전한다면 무한한 가능성을 열 수 있다는 의미의 Open always wins 를 이번 2024 파리 올림픽 패럴림픽 캠페인 메시지로 확정한 바 있다.","삼성전자가 프랑스 파리에서 올림픽 메시지 'Open always wins'를 담은 옥외 광고를 진행하고 있다.. 삼성전자 제공 삼성전자가 프랑스 파리에서 올림픽 옥외광고를 선보이며 2024 파리 올림픽 분위기를 고조시키고 있다고 23일 밝혔다. 삼성전자의 올림픽 옥외광고는 프랑스 파리 주요 명소인 '오페라 가르니에', '라 데팡스' 등에서 진행 중이며 패럴림픽이 종료되는 9월 말까지 운영된다. 옥외광고는 삼성전자의 올림픽 메시지 'Open always wins (열린 마음은 언제나 승리한다)'를 담고 있으며, 갤럭시 Z 플립5와 함께 파리 올림픽 신규 종목 '브레이킹'을 표현해 전세계 올림픽 선수들과 팬들의 새로운 가능성을 응원한다. 삼성전자는 '개방성(Openness)'과 '포용성(Inclusivity)'을 중시하는 브랜드 가치를 반영해 열린 마음으로 모두가 협력해 도전한다면 무한한 가능성을 열 수 있다는 의미의 'Open always wins'를 이번 2024 파리 올림픽·패럴림픽 캠페인 메시지로 확정한 바 있다.",파이낸셜뉴스,https://n.news.naver.com/mnews/article/014/0005202997,3
187,186,2024-06-23 08:32:18,"무더위에 에어컨 판매 고공행진…삼성 ""1분에 7대 이상 판매""","가정용 에어컨 지난주 일평균 1만대 판매 80% 이상은 무풍에어컨 = 올여름 역대급 폭염이 예상되는 가운데 인공지능 기능을 강화한 삼성전자 가정용 에어컨이 지난주에만 하루 평균 1만대 넘게 판매된 것으로 집계됐다. 삼성 비스포크 무풍에어컨 삼성스토어 서초에서 매니저가 소비자들에게 비스포크 AI 무풍 갤러리 를 안내하고 있다. 2024.6.23. 삼성전자는 지난 17∼21일 자사 가정용 에어컨의 국내 일일 판매량을 집계한 결과 이같이 나타났다고 23일 밝혔다. 지난 5일간 1분에 7대 이상 판매된 셈이다. 이 기간 판매된 에어컨 중 80% 이상이 무풍에어컨이며, 모든 라인업이 무풍인 가정용 시스템에어컨 판매도 5∼6월 연속 전년 대비 약 25% 증가했다. 2024년형 비스포크 AI 무풍 갤러리 는 전 모델이 에너지소비효율 1∼2등급을 획득했으며, 스마트싱스 AI 절약 모드로 상황별 맞춤 절전이 가능해 에너지 사용량을 최대 30%까지 절약할 수 있다. 빅스비를 적용해 리모컨 없이 음성 명령으로 에어컨의 다양한 기능을 손쉽게 실행할 수도 있다. 가정용 시스템에어컨 인기 역시 판매 증가의 주요인으로 꼽힌다. 거주하는 집에 최대 6대까지 8시간 만에 설치할 수 있는 ","가정용 에어컨 지난주 일평균 1만대 판매…80% 이상은 무풍에어컨 (서울=연합뉴스) 장하나 기자 = 올여름 역대급 폭염이 예상되는 가운데 인공지능(AI) 기능을 강화한 삼성전자 가정용 에어컨이 지난주에만 하루 평균 1만대 넘게 판매된 것으로 집계됐다. 삼성 비스포크 무풍에어컨 (서울=연합뉴스) 삼성스토어 서초에서 매니저가 소비자들에게 '비스포크 AI 무풍 갤러리'를 안내하고 있다. 2024.6.23. [삼성전자 제공. 재판매 및 DB 금지] 삼성전자는 지난 17∼21일 자사 가정용 에어컨의 국내 일일 판매량을 집계한 결과 이같이 나타났다고 23일 밝혔다. 지난 5일간 1분에 7대 이상 판매된 셈이다. 이 기간 판매된 에어컨 중 80% 이상이 무풍에어컨이며, 모든 라인업이 무풍인 가정용 시스템에어컨 판매도 5∼6월 연속 전년 대비 약 25% 증가했다. 2024년형 '비스포크 AI 무풍 갤러리'는 전 모델이 에너지소비효율 1∼2등급을 획득했으며, 스마트싱스 AI 절약 모드로 상황별 맞춤 절전이 가능해 에너지 사용량을 최대 30%까지 절약할 수 있다. 빅스비를 적용해 리모컨 없이 음성 명령으로 에어컨의 다양한 기능을 손쉽게 실행할 수도 있다. 가정용 시스템에어컨 인기 역시 판매 증가의 주요인으로 꼽힌다. 거주하는 집에 최대 6대까지 8시간 만에 설치할 수 있는 '가정용 시스템에어컨 책임시공' 서비스가 장점이다. 지난 5월에는 가정용 시스템에어컨인 '비스포크 AI 무풍 시스템에어컨 인피니트 라인'을 출시했다. 시스템에어컨에도 AI 기능을 탑재, AI 영역을 확장하고 있는 것이다. 삼성전자 관계자는 ""앞으로도 소비자 편의성을 높이는 기술과 AI 기능을 통해 'AI 가전=삼성'이라는 공식을 넘어 '모두를 위한 AI' 비전을 완성해 나갈 것""이라고 밝혔다. hanajjang@yna.co.kr",연합뉴스,https://n.news.naver.com/mnews/article/001/0014763116,5
188,187,2024-06-23 09:10:11,"""수백만원 짜리가 1분에 7대씩""…요즘 미친듯이 팔린다는데","사진=연합뉴스 무더위가 지속되는 가운데 삼성전자 가정용 에어컨이 지난주에만 하루 평균 1만대 넘게 판매됐다. 지난 5일간 1분에 7대 이상 판매된 셈이다. 삼성전자는 지난 17∼21일 자사 가정용 에어컨의 국내 일일 판매량을 집계한 결과 이같이 나타났다고 23일 밝혔다. 판매된 에어컨 중 80% 이상이 무풍 에어컨이었다. 모든 라인업이 무풍인 가정용 시스템에어컨 판매도 5~6월 연속 전년 대비 약 25% 증가했다. 인공지능 기능 강화와 가정용 시스템에어컨 인기 등이 판매 증가의 주요인으로 꼽힌다. 2024년형 비스포크 AI 무풍 갤러리 는 전 모델이 에너지소비효율 1∼2등급을 획득했으며, 스마트싱스 AI 절약 모드로 에너지 사용량을 최대 30%까지 절약할 수 있다. 지난 5월에는 가정용 시스템에어컨인 비스포크 AI 무풍 시스템에어컨 인피니트 라인 이 출시됐다.","사진=연합뉴스 무더위가 지속되는 가운데 삼성전자 가정용 에어컨이 지난주에만 하루 평균 1만대 넘게 판매됐다. 지난 5일간 1분에 7대 이상 판매된 셈이다. 삼성전자는 지난 17∼21일 자사 가정용 에어컨의 국내 일일 판매량을 집계한 결과 이같이 나타났다고 23일 밝혔다. 판매된 에어컨 중 80% 이상이 무풍 에어컨이었다. 모든 라인업이 무풍인 가정용 시스템에어컨 판매도 5~6월 연속 전년 대비 약 25% 증가했다. 인공지능(AI) 기능 강화와 가정용 시스템에어컨 인기 등이 판매 증가의 주요인으로 꼽힌다. 2024년형 '비스포크 AI 무풍 갤러리'는 전 모델이 에너지소비효율 1∼2등급을 획득했으며, 스마트싱스 AI 절약 모드로 에너지 사용량을 최대 30%까지 절약할 수 있다. 지난 5월에는 가정용 시스템에어컨인 '비스포크 AI 무풍 시스템에어컨 인피니트 라인'이 출시됐다.",한국경제,https://n.news.naver.com/mnews/article/015/0005000536,2
