,cluster,date,title,first_block,content,company,link,cluster_count
0,-1,2024-12-20 00:02:03,마이크론의 좌절…HBM 2배 팔려도 주가 급락 못막았다,"━ 호실적에도 주가 -15%, 왜 지난 4월 조 바이든 미국 대통령 이 미국 시러큐스에서 산자이 메흐로트라 마이크론 최고경영자 로부터 반도체 웨이퍼를 전달받고 있다. 당시 바이든 대통령은 마이크론에 61억4000만 달러 의 보조금 지급을 발표했고, 이는 지난 10일 확정됐다. 세계 메모리 반도체 3위인 미국 마이크론이 좋은 실적을 내고도 주가는 급락했다. PC 자동차 같은 소비자 제품용 메모리 수요가 얼어붙어, 다음 분기 실적 전망치를 증권가 예상보다 낮게 내놓은 영향이다. 여기에 중국 업체의 저가 메모리 공세가 가시화되는 데다, 중국산 첨단 D램마저 시장에 등장했다. 메모리 3사인 삼성전자 SK하이닉스 마이크론이 모두 고대역폭메모리 등 인공지능 용 메모리에 사활을 거는 이유다. 18일 마이크론은 회계연도 2025년 1분기 매출이 87억1000만 달러 로 전년 동기 대비 84%, 직전 분기 대비 12% 증가했다고 밝혔다. 순이익은 18억7000만 달러 로, 지난해 같은 기간의 12억 달러 적자에서 큰 폭으로 흑자 전환했다. 그럼에도 장 마감 후 마이크론 주가는 15% 넘게 빠졌다. 회사가 내놓은 다음 분기 매출 순익 전망치가 모두 증권가 예상치에 못 미쳤기 ","━ 호실적에도 주가 -15%, 왜 지난 4월 조 바이든 미국 대통령(왼쪽)이 미국 시러큐스에서 산자이 메흐로트라 마이크론 최고경영자(CEO)로부터 반도체 웨이퍼를 전달받고 있다. 당시 바이든 대통령은 마이크론에 61억4000만 달러(약 8조5000억원)의 보조금 지급을 발표했고, 이는 지난 10일 확정됐다. [로이터=연합뉴스] 세계 메모리 반도체 3위인 미국 마이크론이 좋은 실적을 내고도 주가는 급락했다. PC·자동차 같은 소비자 제품용 메모리 수요가 얼어붙어, 다음 분기 실적 전망치를 증권가 예상보다 낮게 내놓은 영향이다. 여기에 중국 업체의 저가 메모리 공세가 가시화되는 데다, 중국산 첨단 D램마저 시장에 등장했다. 메모리 3사인 삼성전자·SK하이닉스·마이크론이 모두 고대역폭메모리(HBM) 등 인공지능(AI)용 메모리에 사활을 거는 이유다. 18일(현지시간) 마이크론은 회계연도 2025년 1분기(9~11월) 매출이 87억1000만 달러(약 12조6200억원)로 전년 동기 대비 84%, 직전 분기 대비 12% 증가했다고 밝혔다. 순이익은 18억7000만 달러(약 2조7000억원)로, 지난해 같은 기간의 12억 달러 적자에서 큰 폭으로 흑자 전환했다. 그럼에도 장 마감 후 마이크론 주가는 15% 넘게 빠졌다. 회사가 내놓은 다음 분기 매출·순익 전망치가 모두 증권가 예상치에 못 미쳤기 때문이다. 이날 실적발표에서 산제이 메흐로트라 최고경영자(CEO)는 “HBM을 포함한 데이터 센터용 D램 수요가 견조해, 첨단 D램 공급은 여전히 빠듯하다”면서도 “스마트폰용 메모리는 내년 한 자릿수 초반대 성장률을 예상한다”고 했다. 자동차용·PC용 메모리 시장은 각각 내년 후반과 연말에야 수요가 늘 거라고 봤다. 이날 마이크론은 2024~2025년 기업용 낸드 메모리 성장률도 기존 전망보다 낮춰 10% 초반대로 봤다. 마이크론의 HBM 매출이 한 분기 만에 두 배 이상 늘고 데이터센터용 매출(HBM 포함)은 1년 새 400% 이상 성장했지만, 소비자용 메모리 판매 감소를 메우기에는 아직 역부족이었다는 얘기다. 이처럼 소비자용 메모리 업황이 부진하고 데이터센터용 낸드(eSSD) 성장세가 주춤하자, 기업들이 바라볼 건 HBM이다. 메모리 3사는 엔비디아·AMD 같은 데이터센터용 AI 가속기 회사, 그중에서도 시장의 90%가량을 독점하는 엔비디아의 신제품 블랙웰에 탑재될 HBM3E(5세대) 납품에 주력하고 있다. 이날 마이크론은 “HBM3E 12단 샘플을 고객사에 전달했고 내년 하반기 12단 제품이 HBM 매출의 대부분을 차지할 것”이라고 밝혔다. HBM 시장 전체 규모는 현재 160억 달러(약 23조원) 수준에서 2028년 4배가 되고, 2030년에 1000억 달러(약 145조원)를 초과할 것으로 전망했다. 앞서 SK하이닉스는 지난 10월 HBM3E 12단 제품 대량 양산을 시작했고, HBM3E 16단은 내년 상반기 양산할 계획이다. 지난달 젠슨 황 엔비디아 CEO는 자사 블랙웰에 SK하이닉스와 마이크론의 HBM3E를 쓰고 있으며, 삼성전자 HBM3E 8단과 12단 제품의 사용 승인을 위해 최대한 빠르게 일하고 있다고 밝힌 바 있다. 중국의 위협도 메모리 3사 공통의 고민이다. 지난 17일 중국의 온라인 쇼핑 가격 비교 사이트에는 ‘중국산’을 내세운 32GB DDR5 제품이 올라왔다. 최신 세대 D램인 DDR5는 PC와 서버에 모두 쓰인다. 중국 창신메모리(CXMT)는 DDR4까지만 개발·판매하고 있는데, 쇼핑몰에 브랜드명 없이 ‘중국산 DDR5’라고 주장한 제품이 등장한 것이다. 구형뿐 아니라 첨단 D램에서도 중국의 공세가 현실로 다가온 셈이다. 다만 미국의 수출 제재로 첨단 공정에 필요한 극자외선(EUV) 노광 장비가 중국에는 반입되지 않아, 한국·미국과 중국의 첨단 D램 기술 격차는 당분간 유지될 전망이다. 미국 기업인 마이크론은 메모리 3사 중 가장 먼저 ‘탈(脫)중국’ 했다. 지난해 5월 중국은 자국 내 주요 IT 인프라에 마이크론 제품 구매를 중단시켰고, 그전까지 마이크론 매출의 25%가량이던 중국 매출은 지난 분기 10% 중반대까지 내려왔다. 그러나 삼성전자와 SK하이닉스의 중국 매출 비중은 각각 30%와 24%로, 여전히 중요한 시장이다.",중앙일보,https://n.news.naver.com/mnews/article/025/0003409247,937
1,0,2024-12-20 11:44:14,"""삼성 직원들은 좋겠네""…'월급의 2배' 파격 성과급 쏜다","삼성, 메모리사업부 직원들에 월급 2배 쏜다 200만원 격려금 도 지급 삼성전자, DS부문 TAI 공지 메모리사업부 기본급 200% DS부문 전 사업부에 격려금도 서울 서초구 삼성전자 사옥 앞. 사진=뉴스1 삼성전자 반도체 사업을 맡는 디바이스솔루션 부문 전 사업부에 걸쳐 반도체사업 50주년 격려금을 지급한다. 특히 DS부문 메모리사업부는 올 하반기 월 기본급의 200%를 성과급으로 받는다. 20일 삼성전자에 따르면 이날 오전 올 하반기 목표달성장려금 지급률이 사내망을 통해 공지됐다. TAI는 삼성전자가 운영하는 성과급 중 하나로 매년 상 하반기로 나눠 한 차례씩 실적을 고려해 지급된다. 소속 사업 부문과 사업부 평가를 종합해 최대 월 기본급의 100%까지 차등 지급되는 것으로 알려졌다. 메모리사업부는 200%의 TAI 지급률이 책정됐다. 지난해와 비교할 때 큰 폭의 실적 개선 성과를 이뤄낸 결과다. DS부문은 그간 반도체 업황 악화 등의 영향으로 비교적 낮은 성과급을 받아야 했다. 실제로 2015년부터 2022년 상반기까진 월 기본급의 100%를 받다가 2022년 하반기엔 실적 둔화 영향으로 50%로 조정됐다. 지난해의 경우 연간 영업손실이 15조원 규모에","삼성, 메모리사업부 직원들에 월급 2배 쏜다 '200만원 격려금'도 지급 삼성전자, DS부문 TAI 공지 메모리사업부 '기본급 200%' DS부문 전 사업부에 격려금도 서울 서초구 삼성전자 사옥 앞. 사진=뉴스1 삼성전자 반도체 사업을 맡는 디바이스솔루션(DS)부문 전 사업부에 걸쳐 반도체사업 50주년 격려금을 지급한다. 특히 DS부문 메모리사업부는 올 하반기 월 기본급의 200%를 성과급으로 받는다. 20일 삼성전자에 따르면 이날 오전 올 하반기 목표달성장려금(TAI) 지급률이 사내망을 통해 공지됐다. TAI는 삼성전자가 운영하는 성과급 중 하나로 매년 상·하반기로 나눠 한 차례씩 실적을 고려해 지급된다. 소속 사업 부문과 사업부 평가를 종합해 최대 월 기본급의 100%까지 차등 지급되는 것으로 알려졌다. 메모리사업부는 200%의 TAI 지급률이 책정됐다. 지난해와 비교할 때 큰 폭의 실적 개선 성과를 이뤄낸 결과다. DS부문은 그간 반도체 업황 악화 등의 영향으로 비교적 낮은 성과급을 받아야 했다. 실제로 2015년부터 2022년 상반기까진 월 기본급의 100%를 받다가 2022년 하반기엔 실적 둔화 영향으로 50%로 조정됐다. 지난해의 경우 연간 영업손실이 15조원 규모에 이르면서 메모리사업부, 파운드리사업부, 시스템LSI 모두 상반기 TAI 지급률이 25%에 그쳤다. 같은 해 하반기엔 메모리사업부만 12.5%로 정해졌고 파운드리사업부와 시스템LSI는 0%였다. 다만 올해는 20조원에 이르는 흑자가 예상되면서 분위기가 반전됐다. 아울러 사기 진작 차원에서 DS부문 전 사업부에 격려금 200만원을 지급할 계획이다.",한국경제,https://n.news.naver.com/mnews/article/015/0005072614,2
2,1,2024-12-20 18:38:30,"'외국인 매도'에 코스피 2,400선...코스닥 670 붕괴","코스피가 외국인과 기관의 매도세에 이틀째 급락했습니다. 원-달러 환율은 이틀째 1,450원대에 머물며 미국 FOMC의 매파적 금리인하 충격에서 벗어나지 못하는 모습입니다. 가 보도합니다. 장중에 2,400선 아래로 내려갔던 코스피가 장 막판에 2,400선을 간신히 지켜냈습니다. 코스피는 전 거래일보다 1.3% 하락한 2,404.15로 마감했습니다. 개인 투자자가 7,900억 원어치 사들였지만 외국인과 기관 투자자가 각각 8,180억, 880억 원어치 순매도에 나서면서 지수를 끌어내렸습니다. 미국 연방준비제도 이사회 파월 의장이 내년 금리인하 속도 조절을 시사한 이후 통화정책의 불확실성이 커졌기 때문입니다. 이에 더해 미국의 마이크론 테크놀로지가 실망스러운 실적 전망을 내놓으며 삼성전자와 SK하이닉스도 모두 하락했습니다. 코스닥지수는 전 거래일보다 2.35% 하락한 668.31로 마감하며 670선이 무너졌습니다. 코스피와 마찬가지로 외국인과 기관 투자자들이 지수를 끌어내렸습니다. 서울 외환시장에서 이틀째 1,450원대로 출발한 원-달러 환율은 오후 3시 반 기준으로 1,451.4원을 기록했습니다. 1,450원대 환율이 이어지자 정부와 한국은행은 외국환은행의 선","[앵커] 코스피가 외국인과 기관의 매도세에 이틀째 급락했습니다. 원-달러 환율은 이틀째 1,450원대에 머물며 미국 FOMC의 '매파적 금리인하' 충격에서 벗어나지 못하는 모습입니다. 최두희 기자가 보도합니다. [기자] 장중에 2,400선 아래로 내려갔던 코스피가 장 막판에 2,400선을 간신히 지켜냈습니다. 코스피는 전 거래일보다 1.3% 하락한 2,404.15로 마감했습니다. 개인 투자자가 7,900억 원어치 사들였지만 외국인과 기관 투자자가 각각 8,180억, 880억 원어치 순매도에 나서면서 지수를 끌어내렸습니다. 미국 연방준비제도 이사회 파월 의장이 내년 금리인하 속도 조절을 시사한 이후 통화정책의 불확실성이 커졌기 때문입니다. 이에 더해 미국의 마이크론 테크놀로지가 실망스러운 실적 전망을 내놓으며 삼성전자와 SK하이닉스도 모두 하락했습니다. [김영환 / NH투자증권 연구원 : FOMC(미국 연방공개시장위원회) 이후에 원-달러 환율이 1,450원 가깝게 상승한 부분이 외국인 수급에 부담을 주고 있고요. 마이크론 실적의 전망이 부정적으로 나타난 부분이…] 코스닥지수는 전 거래일보다 2.35% 하락한 668.31로 마감하며 670선이 무너졌습니다. 코스피와 마찬가지로 외국인과 기관 투자자들이 지수를 끌어내렸습니다. 서울 외환시장에서 이틀째 1,450원대로 출발한 원-달러 환율은 오후 3시 반 기준으로 1,451.4원을 기록했습니다. 1,450원대 환율이 이어지자 정부와 한국은행은 외국환은행의 선물환 포지션 한도를 높이고 수출 기업의 외화대출 요건도 완화하는 등 외환 수급 상황 개선 대책을 발표했습니다. 대외건전성 관리를 위해 외환 유입을 엄격하게 제한했던 정책 기조를 유연화하는 방향으로 바꾸면서 원-달러 환율 급등에 대응하겠다는 취지입니다. YTN 최두희입니다. 촬영기자;권석재 디자인;정은옥 ※ '당신의 제보가 뉴스가 됩니다' [카카오톡] YTN 검색해 채널 추가 [전화] 02-398-8585 [메일] social@ytn.co.kr",YTN,https://n.news.naver.com/mnews/article/052/0002130536,2
3,2,2024-12-20 17:52:27,"입장 바꾼 與 ""여야정 협의체 참여""","경제 안보위기에 선회 탄핵소추후 첫 고위당정 소상공인 예산 조기집행 국민의힘이 여야정 협의체 에 동참하기로 했다. 이로써 12 3 비상계엄 사태 이후 지속되던 국정 혼란을 수습하는 데 다소 숨통이 트일 것으로 전망된다. 권성동 국민의힘 대표 권한대행 겸 원내대표는 20일 민생과 안보 협의를 위한 여야정 협의체에 참여하기로 했다 며 멤버 구성과 관련해선 더불어민주당과 논의하고 있다 고 말했다. 앞서 이재명 민주당 대표의 협의체 제안에 한덕수 대통령 권한대행 국무총리는 즉각 동의했지만 국민의힘은 참여를 주저했다. 하지만 여당도 경제 안보 위기가 심화되고 여론이 악화되자 입장을 선회한 것으로 보인다. 정부 여당은 이날 3개월 만에 고위 당정협의회를 열고 민생 경제 회복을 위해 소상공인 정책융자 규모를 올해보다 600억원 늘리기로 했다. 또 내년 예산을 연초에 조기 집행하기로 했다. 한 권한대행은 이날 제7차 국가첨단전략산업위원회를 주재하고 내년에 25조5000억원 규모의 정책금융을 반도체와 2차전지, 디스플레이, 바이오 등 4대 첨단전략산업에 투입하기로 했다. 한편 총리실 고위 관계자는 이날 한 권한대행이 지난 17~18일 재계와 노동계 대표 8명과 통화했다 고 ","경제·안보위기에 선회 탄핵소추후 첫 고위당정 ""소상공인 예산 조기집행"" 국민의힘이 '여야정 협의체'에 동참하기로 했다. 이로써 12·3 비상계엄 사태 이후 지속되던 국정 혼란을 수습하는 데 다소 숨통이 트일 것으로 전망된다. 권성동 국민의힘 대표 권한대행 겸 원내대표는 20일 ""민생과 안보 협의를 위한 여야정 협의체에 참여하기로 했다""며 ""멤버 구성과 관련해선 더불어민주당과 논의하고 있다""고 말했다. 앞서 이재명 민주당 대표의 협의체 제안에 한덕수 대통령 권한대행 국무총리는 즉각 동의했지만 국민의힘은 참여를 주저했다. 하지만 여당도 경제·안보 위기가 심화되고 여론이 악화되자 입장을 선회한 것으로 보인다. 정부·여당은 이날 3개월 만에 고위 당정협의회를 열고 민생 경제 회복을 위해 소상공인 정책융자 규모를 올해보다 600억원 늘리기로 했다. 또 내년 예산을 연초에 조기 집행하기로 했다. 한 권한대행은 이날 제7차 국가첨단전략산업위원회를 주재하고 내년에 25조5000억원 규모의 정책금융을 반도체와 2차전지, 디스플레이, 바이오 등 4대 첨단전략산업에 투입하기로 했다. 한편 총리실 고위 관계자는 이날 ""한 권한대행이 지난 17~18일 재계와 노동계 대표 8명과 통화했다""고 밝혔다. 한 권한대행이 통화한 상대는 이재용 삼성전자 회장, 최태원 SK 회장, 정의선 현대자동차그룹 회장, 구광모 LG그룹 회장과 류진 한국경제인협회 회장, 김기문 중소기업중앙회 회장이다. 노동계에서는 양경수 민주노총 위원장, 김동명 한국노총 위원장과 통화했다. [안정훈 기자 / 유준호 기자]",매일경제,https://n.news.naver.com/mnews/article/009/0005417295,2
4,3,2024-12-20 21:52:07,[동십자각] '코리아 디스카운트' 대통령 후보 검증해야,"윤경환 투자증권부 차장 “솔직히 말해 한국 주식이 지금 저평가를 받는 것은 아니죠. 지금 주가가 제값이 맞습니다.” 윤석열 대통령이 비상계엄령을 선포하기 직전 현 정부가 임기 내내 해소하겠다는 ‘코리아 디스카운트’ 요인이 도대체 의 집요한 질문에 한 금융 당국 관계자가 내놓은 답변이다. 최근 코스피지수의 부진이 외부 요인보다는 기업들의 인공지능 산업 대응 부족, 실적 악화 등 경제 자체의 체질 저하에 근거한다는 점을 정책 당국도 안다는 뜻이었다. 실제 정부가 코리아 디스카운트 탓만 되풀이하는 사이 대만 증시는 양안 문제를 떠안고도 올해 상승 곡선을 그렸다. 시가총액 1위 상장사인 삼성전자의 주가 하락 이유를 대주주의 횡포에서 찾는 사람도 없다. 남북 군사 대치, 재벌 중심 지배구조 등 한국만의 특수 상황 때문에 국내 증시가 해외보다 평가절하된다는 코리아 디스카운트의 사전적 정의와는 모두 거리가 먼 현상이다. 진단이 잘못됐다 보니 공매도 전면 금지, 기업가치 제고 프로그램 가동 등 정부의 온갖 처방도 증시 부양에 전혀 도움이 되지 않았다. 이제 윤석열 정부는 코리아 디스카운트 문제를 해소하기보다 중대 위험 요인을 추가하는 업적을 더 크게 남긴 듯하다. 바로 ‘","윤경환 투자증권부 차장 [서울경제] “솔직히 말해 한국 주식이 지금 저평가를 받는 것은 아니죠. 지금 주가가 제값이 맞습니다.” 윤석열 대통령이 비상계엄령을 선포하기 직전 현 정부가 임기 내내 해소하겠다는 ‘코리아 디스카운트’ 요인이 도대체 무엇이냐는 기자의 집요한 질문에 한 금융 당국 관계자가 내놓은 답변이다. 최근 코스피지수의 부진이 외부 요인보다는 기업들의 인공지능(AI) 산업 대응 부족, 실적 악화 등 경제 자체의 체질 저하에 근거한다는 점을 정책 당국도 안다는 뜻이었다. 실제 정부가 코리아 디스카운트 탓만 되풀이하는 사이 대만 증시는 양안 문제를 떠안고도 올해 상승 곡선을 그렸다. 시가총액 1위 상장사인 삼성전자의 주가 하락 이유를 대주주의 횡포에서 찾는 사람도 없다. 남북 군사 대치, 재벌 중심 지배구조 등 한국만의 특수 상황 때문에 국내 증시가 해외보다 평가절하된다는 코리아 디스카운트의 사전적 정의와는 모두 거리가 먼 현상이다. 진단이 잘못됐다 보니 공매도 전면 금지, 기업가치 제고(밸류업) 프로그램 가동 등 정부의 온갖 처방도 증시 부양에 전혀 도움이 되지 않았다. 이제 윤석열 정부는 코리아 디스카운트 문제를 해소하기보다 중대 위험 요인을 추가하는 업적을 더 크게 남긴 듯하다. 바로 ‘대통령 독주 리스크’다. 도덕성에 결함이 있거나 독선적인 대통령이 제왕적 권한을 함부로 휘두를 경우 한국의 금융시장이 단번에 고꾸라질 수 있다는 사실을 전 세계가 이번 비상계엄 사태로 알았다. 국내 증시에서 발을 빼던 외국인과 개인투자자들은 더 다급하게 짐을 쌌고 정부는 원화 약세를 막겠다며 쓰지 않았어도 될 돈을 시장에 퍼부었다. 미국 경제 매체 포브스는 “윤 대통령이 코리아 디스카운트가 옳다는 것을 증명했다”고 평가하기도 했다. 기업들의 첨단 기술 경쟁력 약화 문제를 코리아 디스카운트라는 얄팍한 위장막으로 가릴 수는 없다. 현실을 그대로 인정하고 실물 경제의 기초 체력부터 우선 길러야 주가가 반등을 도모할 수 있다. 산업계의 본질적 문제로 떨어진 주가는 ‘제값’이지 ‘깎인 가격’이 아니다. 오히려 조기 대선 가능성이 높아진 현 시점에서 진짜 경계해야 할 지점은 차기 대통령의 자질에 따른 코리아 디스카운트 잔존 여부다. 잘못된 법률 인식, 친인척과 측근의 비리 경력, 부족한 경제 상식 등 대선 후보들이 갖춘 잠재적 위험 요소를 국민이 철저하게 검증해야 반복되는 정치 혼란을 막을 수 있다. 게다가 노무현·박근혜 전 대통령 탄핵 정국 때와 달리 도널드 트럼프 미국 행정부 출범을 앞둔 현 증시에는 대외 호재조차 없다. 지금은 글로벌 자금이 ‘김정은 사망설’이나 ‘북한 핵실험’보다 ‘예측 불가 성향의 대통령’을 더 우려하고 있음을 되새겨야 한다.",서울경제,https://n.news.naver.com/mnews/article/011/0004430658,2
