,cluster,date,title,first_block,content,company,link,cluster_count
99,98,2024-06-20 11:10:18,"진안 토마토이엔씨·참식품, 전북형 프로젝트 대상기업 선정","전북자치도 진안군에 소재한 토마토이엔씨와 참식품이 전북형 스마트 제조혁신 프로젝트 대상기업으로 선정됐다. 전춘성 군수 와 토마토이엔씨 강신택 대표 , 참식품 이재우 대표가 기념촬영을 하고 있다. 2024.6.20/뉴스1 = 전북자치도 진안군은 토마토이엔씨와 참식품 등 진안지역 2개 기업이 전북형 스마트 제조혁신 프로젝트 대상기업으로 선정됐다고 20일 밝혔다. 이번 프로젝트는 전국 최초로 민관 상생 지역특화형 스마트공장 사업추진을 위해 전북자치도와 14개 시 군, 삼성전자가 손을 잡은 사업이다. 진안군과 전북자치도가 투자하고 기업에서 일부 자부담해 삼성 퇴직자 중심 전문 컨설팅단을 통해 제조 혁신기술과 노하우를 연계한 시스템 도입하게 된다. 이를 통해 기업의 생산량 증가, 품질 개선, 원가 절감, 납기 단축을 실현하게 된다. 대상업체 선발과 추진은 전북테크노파크에서 주관하며 진안군은 JS1 단계로 김치류를 제조하는 참식품을 선정했고, JS2 단계로 플라스틱류 제품 제조업체인 토마토이엔씨를 선정했다. 전춘성 군수는 “이번 스마트 혁신기술 도입을 통해 매출 증가와 고용 창출이 기대된다”며 “선정된 기업이 스마트 제조혁신 기업으로 거듭날 수 있도록 행 재정적 지원 ","전북자치도 진안군에 소재한 토마토이엔씨와 참식품이 전북형 스마트 제조혁신 프로젝트 대상기업으로 선정됐다. 전춘성 군수(가운데)와 토마토이엔씨 강신택 대표(왼쪽), 참식품 이재우 대표가 기념촬영을 하고 있다.(진안군제공)2024.6.20/뉴스1 (진안=뉴스1) 김동규 기자 = 전북자치도 진안군은 토마토이엔씨와 참식품 등 진안지역 2개 기업이 전북형 스마트 제조혁신 프로젝트 대상기업으로 선정됐다고 20일 밝혔다. 이번 프로젝트는 전국 최초로 민관 상생 지역특화형 스마트공장 사업추진을 위해 전북자치도와 14개 시·군, 삼성전자가 손을 잡은 사업이다. 진안군과 전북자치도가 투자하고 기업에서 일부 자부담해 삼성 퇴직자 중심 전문 컨설팅단을 통해 제조 혁신기술과 노하우를 연계한 시스템 도입하게 된다. 이를 통해 기업의 생산량 증가, 품질 개선, 원가 절감, 납기 단축을 실현하게 된다. 대상업체 선발과 추진은 전북테크노파크에서 주관하며 진안군은 JS1 단계로(기초1단계) 김치류를 제조하는 참식품을 선정했고, JS2 단계로(기초2단계) 플라스틱류 제품 제조업체인 토마토이엔씨를 선정했다. 전춘성 군수는 “이번 스마트 혁신기술 도입을 통해 매출 증가와 고용 창출이 기대된다”며 “선정된 기업이 스마트 제조혁신 기업으로 거듭날 수 있도록 행·재정적 지원 아끼지 않겠다”고 약속했다.",뉴스1,https://n.news.naver.com/mnews/article/421/0007613113,2
100,99,2024-06-20 12:00:00,"""가정용 스탠드 에어컨… 냉방은 삼성, 소음은 LG가 우수""","소비자원, 주요 브랜드 제품 비교 성능 차이 보여 꼼꼼 비교 필요 시중 판매 중인 가정용 스탠드 에어컨 모델 가운데 냉방속도는 삼성전자 제품이 가장 우수한 것으로 나타났다. LG전자 제품은 타사 제품 대비 소음이 적었다. 한국소비자원은 주요 브랜드 5개 제품의 품질 경제성 안정성 등을 시험평가한 결과 이같이 확인됐다고 20일 밝혔다. 시험평가 대상 제품 모델은 고가형에 해당하는 LG전자 FQ18EN9BE1 과 삼성전자 AF18DX936WFT , 중저가형에 속하는 LG전자 FQ18EV3EA1 , 삼성전자 AF18DX839BZT , 오텍캐리어 EASC-0182RAAMD 등이다. 냉방속도는 3개 제품이 우수한 것으로 조사됐다. 35℃로 유지된 설치 공간에서 에어컨을 24℃ 강풍으로 설정해 작동시킨 뒤 24℃로 낮아질 때까지 소요된 시간을 측정한 결과에서 AF18DX936WFT AF18DX839BZT , FQ18EN9BE1 등 3개 제품이 각각 6분 14초, 6분 16초, 6분 24초를 기록했다. 에어컨을 24℃ 강풍으로 설정한 뒤 5시간 동안 작동하며 설치 공간의 평균 온도를 측정한 설정온도 대비 편차 시험에서는 FQ18EN9BE1 , EASC-0182RAAMD ","소비자원, 주요 브랜드 제품 비교 ""성능 차이 보여…꼼꼼 비교 필요"" 시중 판매 중인 가정용 스탠드 에어컨 모델 가운데 냉방속도는 삼성전자 제품이 가장 우수한 것으로 나타났다. LG전자 제품은 타사 제품 대비 소음이 적었다. 한국소비자원은 주요 브랜드 5개 제품의 품질(냉방속도, 설정온도 대비 편차, 소음 등)·경제성·안정성 등을 시험평가한 결과 이같이 확인됐다고 20일 밝혔다. 시험평가 대상 제품 모델은 고가형에 해당하는 LG전자 'FQ18EN9BE1'과 삼성전자 'AF18DX936WFT', 중저가형에 속하는 LG전자 'FQ18EV3EA1', 삼성전자 'AF18DX839BZT', 오텍캐리어 'EASC-0182RAAMD' 등이다. 냉방속도는 3개 제품이 우수한 것으로 조사됐다. 35℃로 유지된 설치 공간에서 에어컨을 24℃ 강풍으로 설정해 작동시킨 뒤 24℃로 낮아질 때까지 소요된 시간을 측정한 결과에서 AF18DX936WFT·AF18DX839BZT(삼성전자), FQ18EN9BE1(LG전자) 등 3개 제품이 각각 6분 14초, 6분 16초, 6분 24초를 기록했다. 에어컨을 24℃ 강풍으로 설정한 뒤 5시간 동안 작동하며 설치 공간의 평균 온도를 측정한 '설정온도 대비 편차' 시험에서는 FQ18EN9BE1(LG전자), EASC-0182RAAMD(오텍캐리어) 등 2개 제품이 우수한 것으로 나타났다. 2개 제품은 평균온도가 23.6℃로 설정온도 대비 편차(?0.4℃)가 작았다. 소음은 FQ18EV3EA1(LG전자) 제품이 가장 우수했다. 냉방속도 시험 중 에어컨(실내기)에서 발생하는 최대 소음을 측정한 결과 43㏈(A)를 기록했다. 이 밖에 4개 제품은 47㏈(A)~52㏈(A) 범위로 관련 기준(55㏈(A) 이하)에 적합한 수준이었다. 고가형 2개 제품은 미세먼지 제거 먼지 기능이 있었고, 29평대 공기청정기와 성능이 유사했다. 다만 2개 제품에는 일반 공기청정기에 창작되는 유해가스 제거·탈취 필터가 없어 유해가스 제거가 불가능했다. 사실상 공기청정기를 대체할 수 없는 셈인데, 해당 내용은 제품에 표시돼 있지 않아 소비자 오인 가능성이 있다고 소비자원은 지적했다. 냉방모드와 제습모드의 온·습도, 소비전력량(전기요금)은 유의미한 차이가 없었다. 에어컨을 제습모드로 작동 시 습도(시간 평균 59%Rh)가 가정용 제습기(33%Rh)를 이용할 때 더욱 높아 사계절 제습·빨래 건조 등 제습기 기능을 대체할 수 없었다. 구조·전기적 안정성과 오존 발생량은 관련 기준에 적합했으며, 미세먼지 제거 필터에서 유해물질 성분은 검출되지 않았다. 에너지관리공단과 공동으로 제품에 표시된 에너지소비효율등급의 적합 여부를 확인한 결과에선 모든 제품이 표시된 등급과 측정 등급이 일치했다. 소비자원 관계자는 ""에어컨은 고가 제품으로 장기간 사용하는 만큼 제품 구매 전 필요한 보유기능의 구비 여부를 꼼꼼히 확인할 필요가 있다""면서 ""앞으로도 소비자의 합리적인 소비를 지원하기 위해 고효율·친환경 가전제품에 대한 안정성과 품질 비교 정보를 지속 제공할 예정""이라고 밝혔다.",아시아경제,https://n.news.naver.com/mnews/article/277/0005434621,2
101,100,2024-06-20 17:45:19,역대급 '바이 코리아' 코스피 2800선 탈환,외국인 상반기 22조 순매수 20일 외국인 순매수세에 힘입어 코스피는 2022년 1월 이후 2년여 만에 2800을 돌파했다. 이날 코스피는 전월보다 0.37% 오르며 2807.63에 마감했다. 이날 삼성전자도 0.49% 상승하면서 2거래일 연속 8만전자 를 사수했다. 전날 하락했던 SK하이닉스 역시 1.71% 오르면서 상승 전환에 성공했다. 지난달 둔화했던 외국인 수급은 이달 들어 미국 연방준비제도 의 금리 인하 불확실성이 사그라들며 다시 기세를 높이고 있다. 지난 5월에는 미국의 기준금리 인하 시점이 지연될 수 있다는 우려가 부상하면서 월간 기준으로 코스피에서 외국인은 매도 우위를 보였다. 이후 발표된 미국의 5월 소비자물가지수 와 5월 소매판매 등이 전망치를 밑돌면서 금리 인하 기대감이 회복됐다. 지난달 외국인이 삼성전자를 외면하게 한 엔비디아 납품 우려도 소강상태로 접어들며 매수세에 가속도가 붙었다. 증권가에서는 올해 3분기까지는 외국인 매수세가 지속될 것이라는 전망이 나왔다. 바이코리아 기조가 살아나면서 상반기 외국인의 역대 최대 규모 순매수 달성이 가시권에 들었다. 아직 상반기까지 6거래일이 남아 있음에도 삼성전자와 SK하이닉스 인기에 힘입어 외국인,외국인 상반기 22조 순매수 20일 외국인 순매수세에 힘입어 코스피는 2022년 1월 이후 2년여 만에 2800을 돌파했다. 이날 코스피는 전월보다 0.37% 오르며 2807.63에 마감했다. 이날 삼성전자도 0.49% 상승하면서 2거래일 연속 '8만전자'를 사수했다. 전날 하락했던 SK하이닉스 역시 1.71% 오르면서 상승 전환에 성공했다. 지난달 둔화했던 외국인 수급은 이달 들어 미국 연방준비제도(Fed·연준)의 금리 인하 불확실성이 사그라들며 다시 기세를 높이고 있다. 지난 5월에는 미국의 기준금리 인하 시점이 지연될 수 있다는 우려가 부상하면서 월간 기준으로 코스피에서 외국인은 매도 우위를 보였다. 이후 발표된 미국의 5월 소비자물가지수(CPI)와 5월 소매판매 등이 전망치를 밑돌면서 금리 인하 기대감이 회복됐다. 지난달 외국인이 삼성전자를 외면하게 한 '엔비디아 납품' 우려도 소강상태로 접어들며 매수세에 가속도가 붙었다. 증권가에서는 올해 3분기까지는 외국인 매수세가 지속될 것이라는 전망이 나왔다. '바이코리아' 기조가 살아나면서 상반기 외국인의 역대 최대 규모 순매수 달성이 가시권에 들었다. 아직 상반기까지 6거래일이 남아 있음에도 삼성전자와 SK하이닉스 인기에 힘입어 외국인 순매수 기록을 넘어선 상황이다. 이날 한국거래소에 따르면 올해 들어 외국인은 유가증권시장에서 22조2366억원어치를 순매수하면서 상반기 기준 최대 규모 순매수 기록 경신을 눈앞에 뒀다. 현재 상반기 기준 최고 기록은 지난해였다. 당시 반도체 업황 개선 기대감이 커지며 외국인은 유가증권시장에서 12조3182억원어치를 쓸어 담았다. [김정석 기자],매일경제,https://n.news.naver.com/mnews/article/009/0005322268,2
102,101,2024-06-20 17:51:07,"오세훈 시장, 中 장쑤성 당서기 면담…도시 간 교류 활성화 논의","신창싱 당서기 만나 친선교류 협력키로 오 시장, 건강도시연맹 세계총회 관심도 당부 ‘책 읽는 서울광장’ ‘손목닥터 9988’ 등 소개도 오세훈 서울시장은 20일 서울시청에서 신창싱 중국 장쑤성 당서기를 만나 서울시와 장쑤성 간 친선교류 협력에 대해 논의했다. 오세훈 서울시장 과 신창싱 중국 장쑤성 당서기 2023년 1월 장쑤성 당서기로 선출된 신창싱 중국 장쑤성 당서기는 중국공산당의 최고 지도기관인 ‘중국공산당 중앙위원회 ’에서 의결권을 가진 제20차 중앙위원회 위원이자 장쑤성 내 1인자이다. 중국 지자체의 당서기급 인사가 시장을 예방한 것은 지난해 10월 스샤오린 당서기에 이어 두 번째다. 이날 면담은 그간 코로나19 등으로 줄어든 양 도시 간의 우호 교류 활성화 방안을 논의하기 위해 마련됐다. 중국 장쑤성은 삼성전자 , SK하이닉스 , 기아 자동차 , LG전자 등 반도체, 자동차, 배터리 등 한국의 주요 제조 기업 다수가 진출한 곳이다. 서울시와는 2008년 7월 우호도시 협약을 맺고 상호 교류를 지속해왔다. 오 시장도 우호도시 협약차 장쑤성에 방문해 난징의 중산릉, 부자묘 등을 시찰한 바 있다. 이날 면담에서 오 시장은 지난 2008년 방문 시 느낀 장","신창싱 당서기 만나 친선교류 협력키로 오 시장, '건강도시연맹 세계총회' 관심도 당부 ‘책 읽는 서울광장’·‘손목닥터 9988’ 등 소개도 [이데일리 함지현 기자] 오세훈 서울시장은 20일 서울시청에서 신창싱(信長星, Xin Changxing) 중국 장쑤성 당서기를 만나 서울시와 장쑤성 간 친선교류 협력에 대해 논의했다. 오세훈 서울시장(왼쪽)과 신창싱(信長星, Xin Changxing) 중국 장쑤성 당서기(사진=서울시) 2023년 1월 장쑤성 당서기로 선출된 신창싱 중국 장쑤성 당서기는 중국공산당의 최고 지도기관인 ‘중국공산당 중앙위원회(205명)’에서 의결권을 가진 제20차 중앙위원회 위원이자 장쑤성 내 1인자이다. 중국 지자체의 당서기급 인사가 시장을 예방한 것은 지난해 10월 스샤오린(施小琳, Shi Xiaolin) 당서기에 이어 두 번째다. 이날 면담은 그간 코로나19 등으로 줄어든 양 도시 간의 우호 교류 활성화 방안을 논의하기 위해 마련됐다. 중국 장쑤성은 삼성전자(005930)(쑤저우), SK하이닉스(000660)(우시), 기아(000270) 자동차(옌청), LG전자(066570)(난징) 등 반도체, 자동차, 배터리 등 한국의 주요 제조 기업 다수가 진출한 곳이다. 서울시와는 2008년 7월 우호도시 협약을 맺고 상호 교류를 지속해왔다. 오 시장도 우호도시 협약차 장쑤성에 방문해 난징의 중산릉, 부자묘 등을 시찰한 바 있다. 이날 면담에서 오 시장은 지난 2008년 방문 시 느낀 장쑤성에 대한 인상을 전하며 “오늘 방문을 계기로 서울과 장쑤성, 한중간의 관계가 돈독해지는 계기가 되길 바란다“고 말했다. 신 당서기는 서울시와 장쑤성의 더 활발한 교류를 위한 방안으로 △양 도시 간의 고위급 인적교류 지속 추진 △경제무역 교류 △과학기술, 교육문화, 체육 등 다방면으로의 교류 확장 등을 제안했다. 특히, 미래 세대인 청소년층의 교류 추진 필요성을 강조했다. 이날 서울시청을 처음 찾은 신 당서기는 저탄소, 친환경을 표방하는 서울시청사에 대한 긍정적인 인상을 전하기도 했다. 오 시장은 또, 올해 10월 서울의 라이프 스타일을 종합적으로 선보이는 ‘서울 스마트 라이프 위크’와 하반기 개최 예정인 ‘제10차 건강도시연맹 세계총회’ 등을 소개하며, 장쑤성 대표단의 지속적인 관심과 참여를 요청하고, 향후 양 도시 간의 활발한 교류 협력에 있어 싱하이밍 주한중국대사의 협조적인 역할도 기대했다. 이에 싱하이밍 대사도 장쑤성과 서울의 우호 교류를 위한 다리 역할에 노력하겠다는 뜻을 전했다. 오 시장은 짧은 일정에 방한한 신 당서기 등 장쑤성 대표단에 지난해 서울시민이 꼽은 최고의 정책인 ‘책 읽는 서울광장’을 언급하며 이날 저녁에 서울광장에 예정된 행사 현장을 둘러보길 권했다. 아울러 최근 참여자 100만에 돌파한 ‘손목닥터 9988’을 성공적인 건강정책 사례로 소개하기도 했다.",이데일리,https://n.news.naver.com/mnews/article/018/0005769301,5
103,102,2024-06-20 12:00:32,"소비자원 ""에어컨, 서큘레이터와 같이 틀면 냉방속도 26초 빨라""","에어컨 제습 공기청정 기능, 제습기 공기청정기 대체 못 해 냉방모드와 제습모드에 따른 온 습도, 전기요금 차이 없어 = 에어컨을 서큘레이터와 동시에 가동하면 냉방속도가 평균 26초 빨라진다는 시험 결과가 나왔다. 또 에어컨 제습 기능과 공기청정 기능은 각각 일반 제습기, 일반 공기청정기를 대체할 수 없는 것으로 확인됐다. 가정용 스탠드형 에어컨 5개 제품 비교해보니 = 나은수 한국소비자원 기계금속팀장이 20일 오전 정부세종청사 실에서 가정용 스탠드형 에어컨 5개 제품에 대한 품질 , 안전성, 표시사항을 시험ㆍ평가한 비교 정보를 설명하고 있다. 2024.6.20 한국소비자원은 20일 여름철을 앞두고 삼성전자와 LG전자, 오텍캐리어 등 3개사의 58.5㎡형 가정용 스탠드에어컨 5개 모델의 냉방성능과 품질, 안전성을 시험한 결과를 내놓았다. 소비자원에 따르면 실내 온도를 35도에서 24도로 냉방하는 데 걸리는 속도가 에어컨만 사용할 때는 평균 6분50초이지만, 서큘레이터를 동시에 틀면 6분24초로 26초가 줄어든다. 35도에서 24도로 냉방할 때 소비전력량도 에어컨만 가동하면 0.238킬로와트시 로 에어컨과 서큘레이터를 동시에 틀었을 때 합산 소비전력량 보다 많았","에어컨 제습·공기청정 기능, 제습기·공기청정기 대체 못 해 냉방모드와 제습모드에 따른 온·습도, 전기요금 차이 없어 (서울=연합뉴스) 성혜미 기자 = 에어컨을 서큘레이터와 동시에 가동하면 냉방속도가 평균 26초 빨라진다는 시험 결과가 나왔다. 또 에어컨 제습 기능과 공기청정 기능은 각각 일반 제습기, 일반 공기청정기를 대체할 수 없는 것으로 확인됐다. 가정용 스탠드형 에어컨 5개 제품 비교해보니 (세종=연합뉴스) 배재만 기자 = 나은수 한국소비자원 기계금속팀장이 20일 오전 정부세종청사 공정거래위원회 기자실에서 가정용 스탠드형 에어컨 5개 제품에 대한 품질(냉방속도, 온도 정확성, 소음 등), 안전성, 표시사항을 시험ㆍ평가한 비교 정보를 설명하고 있다. 2024.6.20 scoop@yna.co.kr 한국소비자원은 20일 여름철을 앞두고 삼성전자와 LG전자, 오텍캐리어 등 3개사의 58.5㎡형(18평) 가정용 스탠드에어컨 5개 모델의 냉방성능과 품질, 안전성을 시험한 결과를 내놓았다. 소비자원에 따르면 실내 온도를 35도에서 24도로 냉방하는 데 걸리는 속도가 에어컨만 사용할 때는 평균 6분50초이지만, 서큘레이터를 동시에 틀면 6분24초로 26초가 줄어든다. 35도에서 24도로 냉방할 때 소비전력량도 에어컨만 가동하면 0.238킬로와트시(kWh)로 에어컨과 서큘레이터를 동시에 틀었을 때 합산 소비전력량(0.235kWh)보다 많았다. 소비자원 관계자는 ""에어컨 제품에 표시된 냉방 면적보다 넓은 공간을 냉방 할 때 서큘레이터를 효과적으로 활용할 수 있다""고 설명했다. 또 에어컨 제습모드와 가정용 제습기의 실내 온·습도와 소비전력량을 5시간 동안 측정해보니 작동방식에 차이가 있어 에어컨이 제습기까지 대체할 수 없는 것으로 드러났다. 에어컨 제습모드는 온도를 낮게 유지하며 습기를 제거하는 방식이어서 설정온도에 도달하면 실외기가 작동과 멈춤을 반복하지만, 실내기는 계속 바람을 내보내기 때문에 실내기 냉각판에 맺혀있던 물방울이 실내로 유입돼 습도가 더 낮아지지 않는다. 이에 따라 제습기는 제품이 제거할 수 있는 가장 낮은 습도(30%Rh대·상대습도)까지 낮출 수 있지만, 에어컨 제습모드는 일정 습도(50∼60%Rh) 밑으로 내려가지 않아 빨래 건조 등 제습기 기능을 대체할 수 없다고 소비자원은 설명했다. 고가형 에어컨에 장착된 공기 청정 기능 역시 96㎡형(29평) 공기청정기 수준의 미세먼지 제거 성능을 나타냈으나 공기청정기에 장착되는 유해가스 제거·탈취 필터가 없어 톨루엔 등 유해가스 제거가 안 돼 공기청정기를 대체할 수 없었다. 소비자원은 소비자가 에어컨 공기 청정 기능에 대해 오인할 수 있다며 삼성전자와 LG전자에 '유해가스 제거 기능이 없다'는 내용을 표시하라고 권고했다. 이들 업체는 다음 달 중으로 홈페이지 에어컨 제품 정보에 반영하겠다고 답했다. 에어컨 냉방모드와 제습모드의 실내 온·습도 평균 및 소비전력량은 유의미한 차이가 없는 것으로 나타났다. 에어컨을 '24도 냉방'으로 5시간 틀었을 때 실내 평균 온도는 22.9도, 습도는 65%Rh로 각각 조사됐다. '24도 제습'으로 5시간 가동한 경우 실내 평균 온도는 23.1도, 습도는 59%Rh로 각각 나와 양쪽이 비슷했다. ""에어컨, 서큘레이터와 같이 틀면 냉방속도 26초 빨라"" [한국소비자원 자료] 소비자원 5개 모델별 성능시험에서는 가장 고가제품인 LG전자 FQ18EN9BE1(369만원) 모델이 냉방속도(6분24초)와 설정온도 대비 편차(-0.4도)가 작고, 보유기능이 가장 다양한 제품으로 꼽혔다. 냉방속도만 따졌을 때는 삼성전자 AF18DX936WFT(353만원) 모델이 6분14초로 가장 빨랐다. 설정 온도 대비 편차가(-0.4도)도 작고 가격이 가장 저렴한 제품으로는 오텍캐리어의 EASC-0182RAAMD(209만원) 모델이 뽑혔다. 소음이 43데시벨(dB)로 가장 작고 가격이 저렴한 제품으로는 LG전자 FQ18EV3EA1(228만원) 모델이 선정됐다. 소비자원은 ""에어컨은 고가 제품으로 장기간 사용하는 만큼 구매 전에 절전모드와 자동 팬건조, 앱 연동 등 자신이 필요로 하는 기능을 구비했는지 꼼꼼히 확인할 필요가 있다""고 조언했다. [한국소비자원 자료] noanoa@yna.co.kr",연합뉴스,https://n.news.naver.com/mnews/article/001/0014759025,7
